{"$schema":"https://json-schema.org/draft/2020-12/schema","additionalProperties":false,"properties":{"abiSha256":{"const":"e65fb5866c400cee295dde80bd4996b01bb0f0077dcfa313e04b7b8d50d92bbd"},"activationAllowed":{"const":false},"cases":{"items":{"additionalProperties":false,"properties":{"allowedCents":{"maximum":4294967295,"minimum":0,"type":"integer"},"caseId":{"pattern":"^R25-[A-Z0-9-]+$","type":"string"},"decision":{"maximum":1,"minimum":0,"type":"integer"},"failureCode":{"maximum":13,"minimum":0,"type":"integer"},"kind":{"enum":["APPROVAL","DENIAL","COVER","BOUNDARY"]},"mutation":{"type":"string"},"patientResponsibilityCents":{"maximum":4294967295,"minimum":0,"type":"integer"},"paymentCents":{"maximum":4294967295,"minimum":0,"type":"integer"}},"required":["allowedCents","caseId","decision","failureCode","kind","mutation","patientResponsibilityCents","paymentCents"],"type":"object"},"maxItems":20,"minItems":20,"type":"array"},"generation":{"additionalProperties":false,"properties":{"failureSubsets":{"const":8191},"k256Placements":{"const":3840},"profiles":{"const":[128,256,512]}},"required":["failureSubsets","k256Placements","profiles"],"type":"object"},"proofSuiteId":{"type":"null"},"schema":{"const":"blind-ledger-bl-pq512-r25-vector-v1"},"status":{"const":"SYNTHETIC_NONACTIVATING_R25_REFERENCE"}},"required":["abiSha256","activationAllowed","cases","generation","proofSuiteId","schema","status"],"title":"Blind Ledger synthetic nonactivating R25 semantic-vector manifest","type":"object"}
