{"abiSha256":"e65fb5866c400cee295dde80bd4996b01bb0f0077dcfa313e04b7b8d50d92bbd","activationAllowed":false,"cases":[{"allowedCents":100,"caseId":"R25-APPROVAL-ZERO-RESP","decision":1,"failureCode":0,"kind":"APPROVAL","mutation":"patient_responsibility_zero","patientResponsibilityCents":0,"paymentCents":100},{"allowedCents":100,"caseId":"R25-APPROVAL-STANDARD","decision":1,"failureCode":0,"kind":"APPROVAL","mutation":"patient_responsibility_twenty","patientResponsibilityCents":20,"paymentCents":80},{"allowedCents":100,"caseId":"R25-APPROVAL-FULL-RESP","decision":1,"failureCode":0,"kind":"APPROVAL","mutation":"patient_responsibility_equals_allowed","patientResponsibilityCents":100,"paymentCents":0},{"allowedCents":0,"caseId":"R25-DENIAL-01","decision":0,"failureCode":1,"kind":"DENIAL","mutation":"member_id_missing","patientResponsibilityCents":0,"paymentCents":0},{"allowedCents":0,"caseId":"R25-DENIAL-02","decision":0,"failureCode":2,"kind":"DENIAL","mutation":"eligibility_inactive","patientResponsibilityCents":0,"paymentCents":0},{"allowedCents":0,"caseId":"R25-DENIAL-03","decision":0,"failureCode":3,"kind":"DENIAL","mutation":"patient_deceased","patientResponsibilityCents":0,"paymentCents":0},{"allowedCents":0,"caseId":"R25-DENIAL-04","decision":0,"failureCode":4,"kind":"DENIAL","mutation":"provider_npi_missing","patientResponsibilityCents":0,"paymentCents":0},{"allowedCents":0,"caseId":"R25-DENIAL-05","decision":0,"failureCode":5,"kind":"DENIAL","mutation":"provider_not_enrolled","patientResponsibilityCents":0,"paymentCents":0},{"allowedCents":0,"caseId":"R25-DENIAL-06","decision":0,"failureCode":6,"kind":"DENIAL","mutation":"provider_suspended","patientResponsibilityCents":0,"paymentCents":0},{"allowedCents":0,"caseId":"R25-DENIAL-07","decision":0,"failureCode":7,"kind":"DENIAL","mutation":"service_line_missing","patientResponsibilityCents":0,"paymentCents":0},{"allowedCents":0,"caseId":"R25-DENIAL-08","decision":0,"failureCode":8,"kind":"DENIAL","mutation":"diagnosis_missing","patientResponsibilityCents":0,"paymentCents":0},{"allowedCents":0,"caseId":"R25-DENIAL-09","decision":0,"failureCode":9,"kind":"DENIAL","mutation":"prior_authorization_required","patientResponsibilityCents":0,"paymentCents":0},{"allowedCents":0,"caseId":"R25-DENIAL-10","decision":0,"failureCode":10,"kind":"DENIAL","mutation":"invalid_charge","patientResponsibilityCents":0,"paymentCents":0},{"allowedCents":0,"caseId":"R25-DENIAL-11","decision":0,"failureCode":11,"kind":"DENIAL","mutation":"fee_schedule_missing","patientResponsibilityCents":0,"paymentCents":0},{"allowedCents":0,"caseId":"R25-DENIAL-12","decision":0,"failureCode":12,"kind":"DENIAL","mutation":"duplicate_claim","patientResponsibilityCents":0,"paymentCents":0},{"allowedCents":0,"caseId":"R25-DENIAL-13","decision":0,"failureCode":13,"kind":"DENIAL","mutation":"program_integrity_hold","patientResponsibilityCents":0,"paymentCents":0},{"allowedCents":0,"caseId":"R25-DENIAL-ALL","decision":0,"failureCode":1,"kind":"DENIAL","mutation":"all_thirteen_fail","patientResponsibilityCents":0,"paymentCents":0},{"allowedCents":0,"caseId":"R25-COVER-CANONICAL","decision":0,"failureCode":0,"kind":"COVER","mutation":"reserved_cover","patientResponsibilityCents":0,"paymentCents":0},{"allowedCents":5000,"caseId":"R25-BOUNDARY-INNER-MAX","decision":1,"failureCode":0,"kind":"BOUNDARY","mutation":"fifty_lines_sixteen_diagnoses","patientResponsibilityCents":0,"paymentCents":5000},{"allowedCents":200,"caseId":"R25-BOUNDARY-EQUAL-ECONOMICS","decision":1,"failureCode":0,"kind":"BOUNDARY","mutation":"distinct_line_ids_preserved","patientResponsibilityCents":20,"paymentCents":180}],"generation":{"failureSubsets":8191,"k256Placements":3840,"profiles":[128,256,512]},"proofSuiteId":null,"schema":"blind-ledger-bl-pq512-r25-vector-v1","status":"SYNTHETIC_NONACTIVATING_R25_REFERENCE"}
